{
  "$schema": "https://json-schema.org/draft/2020-12/schema",
  "$id": "accuracy.schema.json",
  "title": "RainMan accuracy.json",
  "description": "Contract between the accuracy pipeline (producer) and the site's Accuracy page (consumer).",
  "type": "object",
  "additionalProperties": false,
  "required": [
    "generated_at", "window", "corridors", "points", "departures_evaluated",
    "headline", "by_lead_day", "by_corridor", "methodology_url"
  ],
  "$defs": {
    "rate": { "type": ["number", "null"], "minimum": 0, "maximum": 1 },
    "count": { "type": "integer", "minimum": 0 },
    "date": { "type": "string", "pattern": "^\\d{4}-\\d{2}-\\d{2}$" }
  },
  "properties": {
    "generated_at": { "type": "string", "pattern": "^\\d{4}-\\d{2}-\\d{2}T\\d{2}:\\d{2}:\\d{2}Z$" },
    "window": {
      "type": "object",
      "additionalProperties": false,
      "required": ["start", "end"],
      "properties": { "start": { "$ref": "#/$defs/date" }, "end": { "$ref": "#/$defs/date" } }
    },
    "corridors": { "$ref": "#/$defs/count" },
    "points": { "$ref": "#/$defs/count" },
    "departures_evaluated": { "$ref": "#/$defs/count" },
    "headline": {
      "type": "object",
      "additionalProperties": false,
      "required": ["lead_day", "green_trip_dry_rate", "n_green_trips"],
      "properties": {
        "lead_day": { "type": "integer", "minimum": 1, "maximum": 5 },
        "green_trip_dry_rate": { "$ref": "#/$defs/rate" },
        "n_green_trips": { "$ref": "#/$defs/count" }
      }
    },
    "by_lead_day": {
      "type": "array",
      "minItems": 1,
      "items": {
        "type": "object",
        "additionalProperties": false,
        "required": [
          "lead_day", "green_trip_dry_rate", "okay_trip_dry_rate", "bad_trip_wet_rate",
          "brier_pop", "rain_pod", "rain_far", "n_trips", "n_point_hours"
        ],
        "properties": {
          "lead_day": { "type": "integer", "minimum": 1, "maximum": 5 },
          "green_trip_dry_rate": { "$ref": "#/$defs/rate" },
          "okay_trip_dry_rate": { "$ref": "#/$defs/rate" },
          "bad_trip_wet_rate": { "$ref": "#/$defs/rate" },
          "brier_pop": { "$ref": "#/$defs/rate" },
          "rain_pod": { "$ref": "#/$defs/rate" },
          "rain_far": { "$ref": "#/$defs/rate" },
          "n_trips": { "$ref": "#/$defs/count" },
          "n_point_hours": { "$ref": "#/$defs/count" }
        }
      }
    },
    "by_corridor": {
      "type": "array",
      "items": {
        "type": "object",
        "additionalProperties": false,
        "required": [
          "corridor_id", "name", "green_trip_dry_rate_day1", "brier_pop_day1", "n_trips_day1"
        ],
        "properties": {
          "corridor_id": { "type": "string", "minLength": 1 },
          "name": { "type": "string", "minLength": 1 },
          "green_trip_dry_rate_day1": { "$ref": "#/$defs/rate" },
          "brier_pop_day1": { "$ref": "#/$defs/rate" },
          "n_trips_day1": { "$ref": "#/$defs/count" }
        }
      }
    },
    "methodology_url": { "type": "string", "format": "uri" }
  }
}
